{
  "schema_version": "2",
  "target": {
    "raw": "https://example.com",
    "url": "https://example.com/",
    "scheme": "https",
    "host": "example.com",
    "port": 443,
    "domain": "example.com"
  },
  "captured_at": "2026-10-06T10:00:00Z",
  "coverage": ["crawl", "javascript", "http"],
  "assets": [
    {
      "id": "js_12345",
      "kind": "javascript",
      "value": "https://example.com/bundle.js",
      "coverage": ["javascript"]
    }
  ],
  "observations": [
    {
      "id": "http_12345",
      "kind": "http_response",
      "coverage": ["http"],
      "subject": "https://example.com/",
      "data": {
        "status_code": 200
      }
    }
  ],
  "findings": [],
  "summary": {
    "total_assets": 1,
    "total_observations": 1,
    "total_findings": 0
  }
}
